{
  "problemCode": "P147_FIRE_ESCAPE_DELAY",
  "problemTitle": "불길 속 늦은 출발",
  "problemSource": "DEV_FIXTURE",
  "label": "BOUNDARY_CHECK",
  "labelSource": "negativeControl",
  "skillCodes": [
    "SKILL_COMPOSITION",
    "BFS_SHORTEST_PATH",
    "BFS_VISITED_MANAGEMENT",
    "BFS_GRID_TRAVERSAL"
  ],
  "sourceCode": "\nimport sys\nfrom collections import deque\n\n\ndef main():\n    data = sys.stdin.read().split()\n    n, m = int(data[0]), int(data[1])\n    grid = data[2:2 + n]\n    INF = float('inf')\n    fire = [[INF] * m for _ in range(n)]\n    q = deque()\n    for r in range(n):\n        for c in range(m):\n            ch = grid[r][c]\n            if ch == 'F':\n                fire[r][c] = 0\n                q.append((r, c))\n            elif ch == 'S':\n                sr, sc = r, c\n            elif ch == 'E':\n                er, ec = r, c\n    moves = ((1, 0), (-1, 0), (0, 1), (0, -1))\n    while q:\n        r, c = q.popleft()\n        for dr, dc in moves:\n            nr, nc = r + dr, c + dc\n            if 0 <= nr < n and 0 <= nc < m and grid[nr][nc] != '#' and fire[nr][nc] == INF:\n                fire[nr][nc] = fire[r][c] + 1\n                q.append((nr, nc))\n\n    def can_escape(wait):\n        if wait >= fire[sr][sc]:\n            return False\n        seen = [[False] * m for _ in range(n)]\n        seen[sr][sc] = True\n        q = deque([(sr, sc, wait)])\n        while q:\n            r, c, t = q.popleft()\n            if r == er and c == ec:\n                return True\n            for dr, dc in moves:\n                nr, nc = r + dr, c + dc\n                if nr >= 0 and nc >= 0 and not seen[nr][nc] and grid[nr][nc] != '#' and t + 1 < fire[nr][nc]:\n                    seen[nr][nc] = True\n                    q.append((nr, nc, t + 1))\n        return False\n\n    limit = n * m\n    if can_escape(limit):\n        print('INF')\n        return\n    if not can_escape(0):\n        print(-1)\n        return\n    lo, hi = 0, limit\n    while hi - lo > 1:\n        mid = (lo + hi) // 2\n        if can_escape(mid):\n            lo = mid\n        else:\n            hi = mid\n    print(lo)\n\n\nmain()\n",
  "judge": {
    "status": "RUNTIME_ERROR",
    "failedCaseId": 1,
    "stderr": "Traceback (most recent call last):\n  File \"solution.py\", line 66, in <module>\n    main()\n  File \"solution.py\", line 53, in main\n    if not can_escape(0):\n           ^^^^^^^^^^^^^\n  File \"solution.py\", line 44, in can_escape\n    if nr >= 0 and nc >= 0 and not seen[nr][nc] and grid[nr][nc] != '#' and t + 1 < fire[nr][nc]:\n                                   ~~~~~~~~^^^^\nIndexError: list index out of range\n",
    "passedCaseIds": [
      2,
      4,
      5,
      6,
      7,
      9
    ],
    "failedCaseIds": [
      1,
      3,
      8,
      10,
      11,
      12,
      13,
      14
    ]
  },
  "probes": {}
}
