{
  "problemCode": "P43_GEOMETRIC_SUM_MOD",
  "problemTitle": "거듭제곱 합의 나머지",
  "problemSource": "DEV_FIXTURE",
  "label": "IMPLEMENTATION_MISC",
  "labelSource": "negativeControl",
  "skillCodes": [
    "DIVIDE_AND_CONQUER",
    "RECURSION_BASIC"
  ],
  "sourceCode": "\nimport sys\n\n\ndef solve(a, n, m):\n    if n == 0:\n        return 0, 1 % m\n    s, p = solve(a, n // 2, m)\n    s2 = (s + s * p) % m\n    p2 = p * p % m\n    if n % 2 == 1:\n        p2 = p2 * a % m\n    return s2, p2\n\n\ndef main():\n    a, n, m = map(int, sys.stdin.read().split())\n    a %= m\n    print(solve(a, n, m)[0])\n\n\nmain()\n",
  "judge": {
    "status": "WRONG_ANSWER",
    "failedCaseId": 1,
    "stderr": null,
    "passedCaseIds": [
      3,
      5
    ],
    "failedCaseIds": [
      1,
      2,
      4,
      6,
      7,
      8,
      9,
      10,
      11,
      12
    ]
  },
  "probes": {}
}
