{
  "problemCode": "P36_CLOSEST_PAIR_COUNT",
  "problemTitle": "가장 가까운 두 수와 그 쌍의 개수",
  "problemSource": "DEV_FIXTURE",
  "label": "IMPLEMENTATION_MISC",
  "labelSource": "negativeControl",
  "skillCodes": [
    "SORT_THEN_SCAN",
    "PYTHON_LIST_BASIC"
  ],
  "sourceCode": "\nimport sys\n\n\ndef main():\n    data = sys.stdin.buffer.read().split()\n    n = int(data[0])\n    a = sorted(map(int, data[1:1 + n]))\n    best = min(a[i] - a[i - 1] for i in range(1, n))\n    count = sum(1 for i in range(1, n) if a[i] - a[i - 1] == best)\n    print(best, count)\n\n\nmain()\n",
  "judge": {
    "status": "WRONG_ANSWER",
    "failedCaseId": 2,
    "stderr": null,
    "passedCaseIds": [
      1,
      3,
      6,
      7,
      8,
      9,
      10
    ],
    "failedCaseIds": [
      2,
      4,
      5,
      11
    ]
  },
  "probes": {}
}
