{
  "problemCode": "P03_CONNECTED_COMPONENT",
  "problemTitle": "영역의 개수 세기",
  "problemSource": "DEV_FIXTURE",
  "label": "IMPLEMENTATION_MISC",
  "labelSource": "negativeControl",
  "skillCodes": [
    "BFS_GRID_TRAVERSAL",
    "BFS_VISITED_MANAGEMENT",
    "GRID_BOUNDARY_CHECK"
  ],
  "sourceCode": "import sys\nfrom collections import deque\n\ndata = sys.stdin.read().split()\nn, m = int(data[0]), int(data[1])\ng = [[int(data[2 + i * m + j]) for j in range(m)] for i in range(n)]\n\n# 대각선까지 이어진 것으로 본다 (8방향) - ADVERSARIAL case 에서 갈린다.\nvisited = [[False] * m for _ in range(n)]\ncount = 0\ndirs = [(-1, 0), (1, 0), (0, -1), (0, 1), (-1, -1), (-1, 1), (1, -1), (1, 1)]\nfor si in range(n):\n    for sj in range(m):\n        if g[si][sj] != 1 or visited[si][sj]:\n            continue\n        count += 1\n        visited[si][sj] = True\n        q = deque([(si, sj)])\n        while q:\n            x, y = q.popleft()\n            for dx, dy in dirs:\n                nx, ny = x + dx, y + dy\n                if 0 <= nx < n and 0 <= ny < m and not visited[nx][ny] and g[nx][ny] == 1:\n                    visited[nx][ny] = True\n                    q.append((nx, ny))\nprint(count)\n",
  "judge": {
    "status": "WRONG_ANSWER",
    "failedCaseId": 5,
    "stderr": null,
    "passedCaseIds": [
      1,
      2,
      3,
      4,
      6
    ],
    "failedCaseIds": [
      5
    ]
  },
  "probes": {
    "BOUNDARY_CHECK": [
      3,
      6
    ]
  }
}
