{
  "problemCode": "P68_MIN_MAX_LATENESS",
  "problemTitle": "마감 지연 최소화",
  "problemSource": "DEV_FIXTURE",
  "label": "IMPLEMENTATION_MISC",
  "labelSource": "negativeControl",
  "skillCodes": [
    "GREEDY_CHOICE"
  ],
  "sourceCode": "\nimport sys\n\ndef main():\n    data = sys.stdin.buffer.read().split()\n    n = int(data[0])\n    jobs = []\n    for i in range(n):\n        t = int(data[1 + 2 * i])\n        d = int(data[2 + 2 * i])\n        jobs.append((t, d))\n    jobs.sort()\n    time = 0\n    best = 0\n    for t, d in jobs:\n        time += t\n        if time - d > best:\n            best = time - d\n    print(best)\n\nmain()\n",
  "judge": {
    "status": "WRONG_ANSWER",
    "failedCaseId": 1,
    "stderr": null,
    "passedCaseIds": [
      3,
      4,
      5,
      7,
      8,
      9
    ],
    "failedCaseIds": [
      1,
      2,
      6,
      10,
      11,
      12
    ]
  },
  "probes": {}
}
