{
  "problemCode": "P63_DIRECTED_CYCLE_CHECK",
  "problemTitle": "작업 의존 관계의 순환 검사",
  "problemSource": "DEV_FIXTURE",
  "label": "IMPLEMENTATION_MISC",
  "labelSource": "negativeControl",
  "skillCodes": [
    "GRAPH_CYCLE_DETECTION",
    "DFS_TRAVERSAL"
  ],
  "sourceCode": "\nimport sys\n\n\ndef main():\n    data = sys.stdin.buffer.read().split()\n    n = int(data[0])\n    m = int(data[1])\n    adj = [[] for _ in range(n + 1)]\n    idx = 2\n    for _ in range(m):\n        u = int(data[idx])\n        v = int(data[idx + 1])\n        idx += 2\n        adj[u].append(v)\n    state = [0] * (n + 1)\n    for s in range(1, n + 1):\n        if state[s]:\n            continue\n        state[s] = 1\n        stack = [(s, 0)]\n        while stack:\n            u, i = stack[-1]\n            if i < len(adj[u]):\n                stack[-1] = (u, i + 1)\n                v = adj[u][i]\n                if state[v] != 0:\n                    print('YES')\n                    return\n                if state[v] == 0:\n                    state[v] = 1\n                    stack.append((v, 0))\n            else:\n                state[u] = 2\n                stack.pop()\n    print('NO')\n\n\nmain()\n",
  "judge": {
    "status": "WRONG_ANSWER",
    "failedCaseId": 1,
    "stderr": null,
    "passedCaseIds": [
      2,
      3,
      4,
      6,
      8,
      10
    ],
    "failedCaseIds": [
      1,
      5,
      7,
      9,
      11
    ]
  },
  "probes": {}
}
