{
  "problemCode": "P125_DOMINO_TILE_FLOOR",
  "problemTitle": "막힌 바닥에 타일 깔기",
  "problemSource": "DEV_FIXTURE",
  "label": "BOUNDARY_CHECK",
  "labelSource": "negativeControl",
  "skillCodes": [
    "BIPARTITE_MATCHING",
    "GRID_COORDINATE",
    "GRID_BOUNDARY_CHECK"
  ],
  "sourceCode": "\nimport sys\n\n\ndef main():\n    data = sys.stdin.read().split()\n    n, m = int(data[0]), int(data[1])\n    grid = data[2:2 + n]\n    idx = {}\n    for r in range(n):\n        for c in range(m):\n            if grid[r][c] == '.' and (r + c) % 2 == 1:\n                idx[(r, c)] = len(idx)\n    adj = []\n    for r in range(n):\n        for c in range(m):\n            if grid[r][c] == '.' and (r + c) % 2 == 0:\n                nb = []\n                for dr, dc in ((1, 0), (-1, 0), (0, 1), (0, -1)):\n                    nr, nc = r + dr, c + dc\n                    if 0 <= nr and 0 <= nc < m and grid[nr][nc] == '.':\n                        nb.append(idx[(nr, nc)])\n                adj.append(nb)\n    left = len(adj)\n    match_l = [-1] * left\n    match_r = [-1] * len(idx)\n    sys.setrecursionlimit(10000)\n    seen = []\n\n    def augment(u):\n        for v in adj[u]:\n            if not seen[v]:\n                seen[v] = True\n                if match_r[v] == -1 or augment(match_r[v]):\n                    match_l[u] = v\n                    match_r[v] = u\n                    return True\n        return False\n\n    result = 0\n    while True:\n        seen = [False] * len(idx)\n        found = False\n        for u in range(left):\n            if match_l[u] == -1 and augment(u):\n                result += 1\n                found = True\n        if not found:\n            break\n    print(result)\n\n\nmain()\n",
  "judge": {
    "status": "RUNTIME_ERROR",
    "failedCaseId": 1,
    "stderr": "Traceback (most recent call last):\n  File \"solution.py\", line 53, in <module>\n    main()\n  File \"solution.py\", line 21, in main\n    if 0 <= nr and 0 <= nc < m and grid[nr][nc] == '.':\n                                   ~~~~^^^^\nIndexError: list index out of range\n",
    "passedCaseIds": [
      2,
      4,
      6,
      12
    ],
    "failedCaseIds": [
      1,
      3,
      5,
      7,
      8,
      9,
      10,
      11
    ]
  },
  "probes": {}
}
